{
  "$schema": "./schema/github.schema.json",
  "user": "sugixp",
  "repos": [
    {
      "name": "portfolio",
      "description": null,
      "url": "https://github.com/sugixp/portfolio",
      "homepage": null,
      "language": "JavaScript",
      "stars": 1,
      "archived": false,
      "lastCommit": {
        "sha": "ec4cfa3",
        "date": "2026-10-28T07:58:54Z",
        "message": "docs(readme): record the custompc swap and what to check on resuming"
      }
    },
    {
      "name": "custompc",
      "description": "Monte seu PC com preços em reais, lojas brasileiras e verificação de compatibilidade · PC builder for Brazil",
      "url": "https://github.com/sugixp/custompc",
      "homepage": "https://custompc-builder.vercel.app",
      "language": "TypeScript",
      "stars": 1,
      "archived": false,
      "lastCommit": {
        "sha": "954bc82",
        "date": "2026-10-28T07:38:35Z",
        "message": "docs: close Phase 1 with the demo address and the next steps"
      }
    },
    {
      "name": "task-api",
      "description": null,
      "url": "https://github.com/sugixp/task-api",
      "homepage": null,
      "language": "Python",
      "stars": 0,
      "archived": false,
      "lastCommit": {
        "sha": "215a441",
        "date": "2026-08-18T18:52:18Z",
        "message": "Update README"
      }
    },
    {
      "name": "biblioteca-csharp",
      "description": null,
      "url": "https://github.com/sugixp/biblioteca-csharp",
      "homepage": null,
      "language": "C#",
      "stars": 0,
      "archived": false,
      "lastCommit": {
        "sha": "dec41d3",
        "date": "2026-08-13T11:30:28Z",
        "message": "Corrige o README"
      }
    },
    {
      "name": "task-manager",
      "description": null,
      "url": "https://github.com/sugixp/task-manager",
      "homepage": null,
      "language": "Python",
      "stars": 0,
      "archived": false,
      "lastCommit": {
        "sha": "d6babbf",
        "date": "2026-08-03T03:51:51Z",
        "message": "Add README"
      }
    },
    {
      "name": "currency-converter",
      "description": null,
      "url": "https://github.com/sugixp/currency-converter",
      "homepage": null,
      "language": "Python",
      "stars": 0,
      "archived": false,
      "lastCommit": {
        "sha": "8bd36d3",
        "date": "2026-08-03T02:37:24Z",
        "message": "Add README"
      }
    },
    {
      "name": "data_visual",
      "description": null,
      "url": "https://github.com/sugixp/data_visual",
      "homepage": null,
      "language": "JavaScript",
      "stars": 0,
      "archived": false,
      "lastCommit": {
        "sha": "954c687",
        "date": "2025-10-08T02:46:09Z",
        "message": "Update README.md"
      }
    },
    {
      "name": "dotfiles",
      "description": "my-arch-linux",
      "url": "https://github.com/sugixp/dotfiles",
      "homepage": null,
      "language": "Shell",
      "stars": 0,
      "archived": false,
      "lastCommit": {
        "sha": "ac8b13a",
        "date": "2025-04-13T12:32:01Z",
        "message": "Add .gitignore"
      }
    },
    {
      "name": "ibm_data_science",
      "description": null,
      "url": "https://github.com/sugixp/ibm_data_science",
      "homepage": null,
      "language": "Jupyter Notebook",
      "stars": 0,
      "archived": false,
      "lastCommit": {
        "sha": "5a5c2b1",
        "date": "2025-03-30T07:57:22Z",
        "message": "Data wrangling"
      }
    },
    {
      "name": "Game_Project",
      "description": null,
      "url": "https://github.com/sugixp/Game_Project",
      "homepage": null,
      "language": "JavaScript",
      "stars": 0,
      "archived": false,
      "lastCommit": {
        "sha": "f2cb8d6",
        "date": "2024-06-09T05:15:32Z",
        "message": "Instructions and cleaning"
      }
    }
  ],
  "languages": [
    {
      "name": "Jupyter Notebook",
      "bytes": 1104646,
      "share": 0.643
    },
    {
      "name": "TypeScript",
      "bytes": 358471,
      "share": 0.209
    },
    {
      "name": "JavaScript",
      "bytes": 194066,
      "share": 0.113
    },
    {
      "name": "CSS",
      "bytes": 29893,
      "share": 0.017
    },
    {
      "name": "C#",
      "bytes": 13771,
      "share": 0.008
    },
    {
      "name": "Python",
      "bytes": 13494,
      "share": 0.008
    },
    {
      "name": "HTML",
      "bytes": 2753,
      "share": 0.002
    },
    {
      "name": "Dockerfile",
      "bytes": 202,
      "share": 0
    },
    {
      "name": "Shell",
      "bytes": 172,
      "share": 0
    }
  ],
  "recentActivity": [
    {
      "type": "push",
      "repo": "portfolio",
      "date": "2026-10-28T07:57:20Z",
      "commits": 0
    },
    {
      "type": "push",
      "repo": "custompc",
      "date": "2026-10-28T06:54:08Z",
      "commits": 0
    },
    {
      "type": "push",
      "repo": "custompc",
      "date": "2026-10-28T06:42:47Z",
      "commits": 0
    },
    {
      "type": "create",
      "repo": "custompc",
      "date": "2026-10-28T06:34:42Z"
    },
    {
      "type": "push",
      "repo": "custompc",
      "date": "2026-10-28T06:16:23Z",
      "commits": 0
    },
    {
      "type": "push",
      "repo": "custompc",
      "date": "2026-10-28T05:40:24Z",
      "commits": 0
    },
    {
      "type": "push",
      "repo": "custompc",
      "date": "2026-10-28T05:19:55Z",
      "commits": 0
    },
    {
      "type": "push",
      "repo": "custompc",
      "date": "2026-10-28T05:17:40Z",
      "commits": 0
    },
    {
      "type": "push",
      "repo": "custompc",
      "date": "2026-10-28T06:06:53Z",
      "commits": 0
    },
    {
      "type": "push",
      "repo": "portfolio",
      "date": "2026-10-27T23:40:26Z",
      "commits": 0
    },
    {
      "type": "push",
      "repo": "custompc",
      "date": "2026-10-28T01:55:20Z",
      "commits": 0
    },
    {
      "type": "push",
      "repo": "custompc",
      "date": "2026-10-28T00:36:29Z",
      "commits": 0
    },
    {
      "type": "push",
      "repo": "custompc",
      "date": "2026-10-28T00:23:52Z",
      "commits": 0
    },
    {
      "type": "push",
      "repo": "portfolio",
      "date": "2026-10-27T21:20:49Z",
      "commits": 0
    },
    {
      "type": "push",
      "repo": "custompc",
      "date": "2026-10-28T05:42:38Z",
      "commits": 0
    }
  ]
}
